timestamp,test_name,passed,message
20250429_145029,Temperature update basic run,True,Function executed without errors
20250429_145029,Optimizer state updated,True,Expected optimizer state to be updated
20250429_145029,Temperature value changed,True,"Expected temperature to change from 0.2 to a different value, got 0.19993998110294342"
20250429_145029,Temperature loss is scalar,True,"Expected scalar loss, got shape ()"
20250429_145029,Target entropy affects temperature,False,"Expected higher target entropy to decrease temperature, got 2.778102617742584e-12 vs 2.778097413572156e-12"
20250429_145029,Monotonic relationship between target entropy and temperature,False,Expected monotonic relationship between target entropy and temperature
20250429_145029,Log probabilities affect temperature correctly,False,"Expected more negative log probs to decrease temperature more, got 2.778102617742584e-12 vs 2.7780919925612935e-12"
20250429_145029,Monotonic relationship between log probs and temperature,False,Expected monotonic relationship between log probs and temperature
20250429_145029,Small temperature change when log probs match target,True,"Expected small change when log probs match target. Initial: 0.2, New: 0.20000000298023224"
